title,description
"Implementar Autenticação","Implementar sistema de login e autenticação de usuários usando JWT."
"Configurar Banco de Dados","Configurar banco de dados PostgreSQL e estabelecer conexão com a aplicação."
"Criar Tabela de Usuários","Criar tabela de usuários com campos para nome, email e senha."
"Desenvolver Página de Login","Desenvolver interface de login com validação de campos."
"Adicionar Registro de Usuários","Implementar funcionalidade de registro de novos usuários na aplicação."
"Configurar Roteamento","Configurar rotas para navegação entre diferentes páginas da aplicação."
"Criar Middleware de Autorização","Implementar middleware para proteger rotas que requerem autenticação."
"Desenvolver Página de Perfil","Desenvolver página de perfil de usuário exibindo informações básicas."
"Implementar Reset de Senha","Adicionar funcionalidade para recuperação e reset de senha de usuários."
"Criar Tabela de Tarefas","Criar tabela de tarefas com campos para título, descrição e status."
"Desenvolver CRUD de Tarefas","Implementar operações de criar, ler, atualizar e deletar tarefas."
"Adicionar Filtros de Tarefas","Adicionar funcionalidade para filtrar tarefas por status e prioridade."
"Implementar Upload de Arquivos","Adicionar funcionalidade para upload de arquivos anexos às tarefas."
"Configurar Notificações","Implementar sistema de notificações para alertar usuários sobre mudanças nas tarefas."
"Criar Tabela de Comentários","Criar tabela para armazenar comentários em tarefas."
"Desenvolver Sistema de Comentários","Adicionar funcionalidade para usuários comentarem em tarefas."
"Implementar Sistema de Tags","Adicionar funcionalidade para usuários adicionarem tags às tarefas."
"Configurar Pesquisa de Tarefas","Adicionar funcionalidade de busca para encontrar tarefas específicas."
"Criar Dashboard de Tarefas","Desenvolver dashboard para visualização geral das tarefas."
"Adicionar Autenticação via Google","Integrar autenticação via Google OAuth."
"Desenvolver Página de Configurações","Adicionar página para usuários configurarem preferências pessoais."
"Implementar Sistema de Notas","Adicionar funcionalidade para usuários criarem e editarem notas pessoais."
"Adicionar Funcionalidade de Exportação","Implementar exportação de dados das tarefas em formato CSV."
"Configurar Testes Automatizados","Adicionar testes automatizados para garantir a qualidade do código."
"Implementar Deploy Automático","Configurar CI/CD para deploy automático da aplicação."
"Desenvolver Página de Ajuda","Adicionar página com FAQs e documentação de uso da aplicação."
"Configurar Cache","Implementar cache para melhorar a performance da aplicação."
"Adicionar Funcionalidade de Mensagens","Implementar sistema de mensagens privadas entre usuários."
"Implementar Funcionalidade de Like","Adicionar funcionalidade de curtidas em comentários e tarefas."
"Desenvolver Página de Estatísticas","Adicionar página com estatísticas sobre uso e performance da aplicação."
"Criar Sistema de Feedback","Adicionar funcionalidade para usuários enviarem feedback sobre a aplicação."
"Configurar Logs de Erros","Implementar sistema de logging para monitorar erros e eventos na aplicação."
"Implementar Autenticação via Facebook","Integrar autenticação via Facebook OAuth."
"Adicionar Funcionalidade de Seguidores","Implementar sistema de seguidores para usuários acompanharem atividades de outros."
"Desenvolver Página de Rankings","Adicionar página com rankings de usuários e tarefas mais populares."
"Implementar Funcionalidade de Dark Mode","Adicionar opção de modo escuro para a interface da aplicação."
"Configurar API Externa","Integrar API externa para buscar dados adicionais."
"Adicionar Funcionalidade de Backup","Implementar sistema de backup para dados críticos da aplicação."
"Desenvolver Página de Atualizações","Adicionar página para exibir histórico de atualizações da aplicação."
"Configurar WebSockets","Implementar WebSockets para comunicação em tempo real."
"Adicionar Funcionalidade de Tarefas Recorrentes","Implementar criação de tarefas recorrentes."
"Desenvolver Página de Equipe","Adicionar página com informações sobre a equipe de desenvolvimento."
"Implementar Funcionalidade de Relatórios","Adicionar geração de relatórios personalizados para usuários."
"Configurar Middleware de Segurança","Adicionar middleware para proteção contra ataques comuns."
"Implementar Funcionalidade de Análises","Adicionar ferramentas de análise de dados para usuários."
"Criar Sistema de Pontuação","Implementar sistema de pontuação para engajar usuários."
"Adicionar Funcionalidade de Integrações","Implementar integração com ferramentas externas como Slack e Trello."
"Desenvolver Página de Termos de Uso","Adicionar página com termos de uso e políticas de privacidade."
"Configurar Internacionalização","Adicionar suporte a múltiplos idiomas na aplicação."
"Implementar Funcionalidade de Aprovação","Adicionar workflow de aprovação para determinadas ações na aplicação."
"Desenvolver Página de Sobre","Adicionar página com informações sobre a aplicação e sua missão."
"Adicionar Funcionalidade de Widgets","Implementar widgets personalizáveis para o dashboard."
"Configurar Sistema de Pagamentos","Integrar sistema de pagamentos para funcionalidades premium."
"Implementar Funcionalidade de Gamificação","Adicionar elementos de gamificação para aumentar engajamento."
"Desenvolver Página de Carreiras","Adicionar página com oportunidades de carreira na empresa."
"Configurar Modo Offline","Implementar suporte para uso da aplicação em modo offline."
"Adicionar Funcionalidade de Checklists","Implementar checklists dentro de tarefas."
"Desenvolver Página de Conquistas","Adicionar página para exibir conquistas e badges dos usuários."
"Implementar Funcionalidade de Multiusuário","Adicionar suporte para múltiplos usuários colaborando na mesma tarefa."
"Configurar Sistema de Suporte","Adicionar funcionalidade de suporte ao cliente via chat ou ticket."
"Desenvolver Página de Blog","Adicionar blog para publicação de artigos e notícias."
"Implementar Funcionalidade de Revisão","Adicionar sistema de revisão e aprovação de conteúdo."
"Configurar Análise de Sentimento","Integrar análise de sentimento para feedback e comentários."
"Adicionar Funcionalidade de Pesquisa Avançada","Implementar busca avançada com filtros detalhados."
"Desenvolver Página de Portfolio","Adicionar página para exibição de portfólios de projetos."
"Implementar Funcionalidade de SSO","Adicionar suporte para Single Sign-On."
"Configurar Funcionalidade de A/B Testing","Implementar A/B testing para testar diferentes versões da aplicação."
"Adicionar Funcionalidade de Chatbots","Integrar chatbots para suporte automatizado."
"Desenvolver Página de Contato","Adicionar página com formulário de contato e informações de suporte."
"Implementar Funcionalidade de E-mail Marketing","Adicionar integração para campanhas de e-mail marketing."
"Configurar Análise de Performance","Adicionar ferramentas para monitoramento de performance da aplicação."
"Adicionar Funcionalidade de Importação de Dados","Implementar importação de dados de outras plataformas."
"Desenvolver Página de FAQ","Adicionar página com perguntas frequentes e respostas."
"Implementar Funcionalidade de Feedback de UX","Adicionar coleta de feedback de experiência do usuário."
"Configurar Funcionalidade de Testes de Usabilidade","Implementar testes de usabilidade para melhorar a interface."
"Adicionar Funcionalidade de Enquetes","Implementar sistema de enquetes para coletar opiniões dos usuários."
"Desenvolver Página de Eventos","Adicionar página para exibição e gerenciamento de eventos."
"Implementar Funcionalidade de Analytics","Adicionar ferramentas de analytics para monitoramento de uso."
"Configurar Funcionalidade de Videoconferência","Integrar videoconferência para reuniões e colaboração."
"Adicionar Funcionalidade de Assinaturas","Implementar sistema de assinaturas para conteúdos exclusivos."
"Desenvolver Página de Recursos","Adicionar página com recursos e materiais de apoio para usuários."
"Implementar Funcionalidade de Mapas","Integrar mapas para visualização geográfica de dados."
"Configurar Sistema de Alertas","Adicionar sistema de alertas e notificações em tempo real."
"Adicionar Funcionalidade de Fórum","Implementar fórum de discussão para usuários."
"Desenvolver Página de Testemunhos","Adicionar página para exibir depoimentos de clientes."
"Implementar Funcionalidade de Tarefas Aninhadas","Adicionar suporte para criação de subtarefas."
"Configurar Sistema de Monitoramento","Adicionar ferramentas de monitoramento para análise de sistema."
"Adicionar Funcionalidade de Inteligência Artificial","Integrar IA para sugestões automáticas e melhorias."
"Desenvolver Página de Relacionamento","Adicionar página para gerenciamento de relacionamento com clientes."
"Implementar Funcionalidade de Automação","Adicionar automações para tarefas repetitivas."
"Configurar Funcionalidade de Satisfação do Cliente","Implementar coleta de feedback de satisfação dos clientes."
"Adicionar Funcionalidade de E-learning","Integrar sistema de E-learning para treinamentos e cursos."
"Desenvolver Página de Ofertas","Adicionar página para exibição de ofertas e promoções."